{
  "schema_version": 3,
  "id": "iron-ore",
  "name": "Iron Ore",
  "description": "A heavy chunk of raw iron ore, streaked with rust-red veins. A blacksmith could smelt and forge it into gear.",
  "attributes": {
    "stats": {}
  },
  "effects": [],
  "messages": [],
  "weight": 2,
  "value": 8
}
