{
  "schema_version": 3,
  "id": "health-potion",
  "name": "Health Potion",
  "description": "A small red vial that restores a bit of vitality.",
  "attributes": {
    "stats": {
      "hp": 20
    }
  },
  "effects": [],
  "messages": [
    {
      "phase": "quaff",
      "channel": "self",
      "text": "You quaff {item}."
    },
    {
      "phase": "quaff",
      "channel": "room",
      "text": "{source} quaffs {item}."
    }
  ],
  "weight": 1,
  "value": 15
}
